{"base_site":{"path":"/secure/operator/azure-cpu-materializer-site.json","sha256":"aaaaaaaaaaaaaaaaaaaaaaaaaaaaaaaaaaaaaaaaaaaaaaaaaaaaaaaaaaaaaaaa","size_bytes":4096},"kind":"sparkinterval.azure.cpu.prop1224-materializer-site.v1","prop1224":{"gmp_source_root":"/secure/upstreams/gmp-6.3.0","mpfr_source_root":"/secure/upstreams/mpfr-4.2.1","predecessor_exports":[]},"schema_version":1}
